{
	"$schema": "prc-chart-handoff/v1",
	"version": "1.0.0",
	"chartType": "scatter",
	"orientation": "horizontal",
	"data": {
		"values": [
			{ "gdp": 45000, "approval": 62, "country": "Germany" },
			{ "gdp": 32000, "approval": 55, "country": "Spain" },
			{ "gdp": 52000, "approval": 70, "country": "France" },
			{ "gdp": 28000, "approval": 48, "country": "Poland" }
		],
		"xColumn": "gdp",
		"yColumn": "approval",
		"categoryColumn": "country",
		"xType": "numeric",
		"yType": "percentage"
	},
	"metadata": {
		"title": "GDP vs. Approval",
		"subtitle": "% approving by GDP per capita",
		"note": "",
		"source": "Source: Pew Research Center"
	},
	"config": {
		"colors": ["#436983"],
		"scatterOptions": {
			"showRegressionLine": true,
			"regressionType": "linear"
		}
	},
	"source": {
		"tool": "pewplots",
		"toolVersion": "3.1.0",
		"exportedAt": "2026-04-07T12:00:00Z",
		"palette": null,
		"paletteScale": null
	},
	"warnings": []
}
