{
	"$schema": "prc-chart-handoff/v1",
	"version": "1.0.0",
	"chartType": "dot-plot",
	"orientation": "horizontal",
	"data": {
		"values": [
			{ "topic": "Climate", "pct": 72, "group": "Democrat" },
			{ "topic": "Climate", "pct": 21, "group": "Republican" },
			{ "topic": "Economy", "pct": 45, "group": "Democrat" },
			{ "topic": "Economy", "pct": 68, "group": "Republican" }
		],
		"xColumn": "pct",
		"yColumn": "topic",
		"categoryColumn": "group",
		"xType": "numeric",
		"yType": "percentage"
	},
	"metadata": {
		"title": "Partisan Gap by Topic",
		"subtitle": "% saying issue is very important",
		"note": "",
		"source": "Source: Pew Research Center"
	},
	"config": {
		"colors": ["#456A83", "#BF3B27"],
		"dependentAxis": { "tickUnit": "%" },
		"dotPlotOptions": { "connectPoints": true }
	},
	"source": {
		"tool": "pewplots",
		"toolVersion": "3.1.0",
		"exportedAt": "2026-04-07T12:00:00Z",
		"palette": "partisan",
		"paletteScale": "auto"
	},
	"warnings": []
}
