{
	"$schema": "prc-chart-handoff/v1",
	"version": "1.0.0",
	"chartType": "stacked-bar",
	"orientation": "horizontal",
	"data": {
		"values": [
			{ "country": "Germany", "share": 40, "opinion": "Favorable" },
			{ "country": "Germany", "share": 20, "opinion": "Neutral" },
			{ "country": "Germany", "share": 40, "opinion": "Unfavorable" },
			{ "country": "Spain",   "share": 50, "opinion": "Favorable" },
			{ "country": "Spain",   "share": 15, "opinion": "Neutral" },
			{ "country": "Spain",   "share": 35, "opinion": "Unfavorable" }
		],
		"xColumn": "country",
		"yColumn": "share",
		"categoryColumn": "opinion",
		"xType": "categorical",
		"yType": "percentage"
	},
	"metadata": {
		"title": "Stacked Views",
		"subtitle": "",
		"note": "",
		"source": "Source: Pew Research Center"
	},
	"config": {
		"colors": ["#456A83", "#aaaaaa", "#BF3B27"],
		"dependentAxis": { "tickUnit": "%" },
		"barOptions": { "stackOffset": "none" }
	},
	"source": {
		"tool": "pewplots",
		"toolVersion": "3.1.0",
		"exportedAt": "2026-04-07T12:00:00Z",
		"palette": null,
		"paletteScale": null
	},
	"warnings": []
}
