{
	"$schema": "prc-chart-handoff/v1",
	"version": "1.0.0",
	"chartType": "bar",
	"orientation": "vertical",
	"data": {
		"values": [
			{ "year": 2020, "pct": 55 },
			{ "year": 2021, "pct": 60 },
			{ "year": 2022, "pct": 58 },
			{ "year": 2023, "pct": 63 }
		],
		"xColumn": "year",
		"yColumn": "pct",
		"categoryColumn": null,
		"xType": "numeric",
		"yType": "percentage"
	},
	"metadata": {
		"title": "Annual Approval",
		"subtitle": "% approving",
		"note": "",
		"source": "Source: Pew Research Center"
	},
	"config": {
		"colors": ["#436983"],
		"dependentAxis": { "tickUnit": "%" }
	},
	"source": {
		"tool": "pewplots",
		"toolVersion": "3.1.0",
		"exportedAt": "2026-04-07T12:00:00Z",
		"palette": null,
		"paletteScale": null
	},
	"warnings": []
}
